{
  "version": "1.1.0",
  "updatedAt": "2026-03-28T11:00:00.000Z",
  "extensionInstalled": true,
  "connected": true,
  "shareRequired": false,
  "userGestureRequired": false,
  "resumable": false,
  "resumeRequiresUserGesture": true,
  "expiresAt": "2026-03-28T12:00:00.000Z",
  "sharedTab": {
    "id": "tab-123",
    "title": "Relay Example",
    "url": "https://example.com/shared"
  }
}
